{
  "$schema":"https://json-schema.org/draft/2020-12/schema",
  "$id":"bopen://schemas/governance/goal-register/0.1.0-draft",
  "status":"draft","title":"bOPEN Goal Register","type":"object",
  "required":["$schema","register_id","version","status","owner_authority","updated_at","entries"],
  "properties":{"$schema":{"const":"bopen://schemas/governance/goal-register/0.1.0-draft"},"register_id":{"type":"string","pattern":"^PG-REG-GOAL-[0-9]{3}$"},"version":{"type":"string","pattern":"^[0-9]+\\.[0-9]+\\.[0-9]+(?:-draft)?$"},"status":{"enum":["draft","approved"]},"owner_authority":{"type":"string","minLength":1},"updated_at":{"type":"string","format":"date-time"},"approved_by":{"type":["string","null"],"minLength":1},"approved_at":{"type":["string","null"],"format":"date-time"},"approval_ref":{"type":["string","null"],"minLength":1},"entries":{"type":"array","items":{"type":"object","required":["goal_id","version","title","status","owner_authority","artifact_ref","phase_ids","metric_ids","approval_ref","approved_at","review_due_at","implementation_authority"],"properties":{"goal_id":{"type":"string","pattern":"^BOPEN-GOAL-[0-9]{3}$"},"version":{"type":"string","minLength":1},"title":{"type":"string","minLength":1},"status":{"enum":["Draft","In Review","Approved","Superseded","Retired"]},"owner_authority":{"type":"string","minLength":1},"artifact_ref":{"type":"string","minLength":1},"phase_ids":{"type":"array","items":{"type":"string","pattern":"^PG-(?:G|P|C)[0-9]+$"},"minItems":1,"uniqueItems":true},"metric_ids":{"type":"array","items":{"type":"string","minLength":1},"uniqueItems":true},"approval_ref":{"type":["string","null"]},"approved_at":{"type":["string","null"],"format":"date-time"},"review_due_at":{"type":["string","null"],"format":"date-time"},"implementation_authority":{"type":"boolean"}},"additionalProperties":false}}},
  "additionalProperties":false
}
